"Клеймо за време","The application was easy to navigate","Were the layout and design visually appealing?","All features and buttons worked as expected","Did you encounter any technical issues or errors while using the application/website?","The content/ information provided was relevant and helpful","Were instructions or descriptions provided clear and understandable?","Did you find any inconsistencies in the information presented?","On a scale of  to 5 how would you rate the speed and responsiveness of the application/website?","The application/website meet your expectations in terms of user-friendliness","Were there any specific areas that you found particularly user-friendly or challenging?","Is there anything specific you would change or improve about the application/website? Do you have any suggestions to enhance the user experience?","On a scale from 1 to 5, how likely are you to recommend this application/website to a friend or colleague?","Would you use this application/website again in the future?"
"2024/01/10 9:12:08 пр.об. Гринуич+1","4","Yes","5","No","5","Yes","No","5","5","Overall a good application","","9","Definitely "
"2024/01/10 6:22:56 сл.об. Гринуич+1","4","Yes","4","No","5","Yes","No","5","5","Yes","No","8","Yes"
"2024/01/10 6:25:21 сл.об. Гринуич+1","5","Yes","5","No at all","5","Yes absolutely ","No","5","5","I liked everything ","The user is doing great ","10","For sure"
"2024/01/10 6:55:36 сл.об. Гринуич+1","5","Quite good job done for these, yeah","5","No","5","Very clear, yes","Not at all","5","5","No, sorry","No","5","Yes"
"2024/01/10 7:53:34 сл.об. Гринуич+1","4","Yes, the colours looked good and in general the application has great user interface","4","No","3","Yes","No","3","4","No","I don’t really have any on top of my mind","8","Yes"
"2024/01/17 1:01:07 сл.об. Гринуич+1","4","It seems ok for such a project while taking into account the time spent. The site is not responsive. Sections are not divided conviniently which obstructs the user experience. Colors shceme is not very vivid, the site mostly is black and white. Icons should be more popping so are more easlihy noticable. Opacity on book hovering is not looking good, because the used images are transparent.","3","yes, as expected from the appearance of the website","3","Clear enough for differentiation of books.","Not sure. I did not had much information present excpet titles of the books as descriptions","4","3","Site awareness when navigation. No much interaction with the user. Navigation bar is one of them.","Please apply as much of the feedback you have gathered from me and other peers. You are a pop folk fan and I understand the struggle. Feel you borther.","6","Definitely when the applied feedback is applied. I would very much like to use the website after the idea is realized. The idea is a strong yes (:🦭🦭🦭:)"